{
  "assets" : [
    {
      "createdAt" : "2026-10-02T00:00:00Z",
      "extension" : "txt",
      "favorite" : true,
      "folderIds" : [
        "22222222-2222-4222-8222-222222222222"
      ],
      "id" : "11111111-1111-4111-8111-111111111111",
      "internetOrigin" : true,
      "kind" : "other",
      "name" : "ＡＢＣ_猫.txt",
      "sha256" : "81ddd820080e6ef073617135f66c6ab91264bc6dbcf68d7a1466d021f8a5db5a",
      "sizeBytes" : 35,
      "tagIds" : [
        "33333333-3333-4333-8333-333333333333"
      ],
      "trashed" : true
    }
  ],
  "createdAt" : "2026-10-04T17:53:55.450Z",
  "excludedPending" : 0,
  "folders" : [
    {
      "id" : "22222222-2222-4222-8222-222222222222",
      "name" : "資料",
      "parentId" : null
    }
  ],
  "searches" : [
    {
      "filter" : {
        "descending" : false,
        "extension" : "txt",
        "folderIds" : [

        ],
        "limit" : 80,
        "offset" : 0,
        "sortBy" : "name",
        "tagIds" : [

        ],
        "text" : "",
        "version" : 2,
        "view" : "trash"
      },
      "id" : "55555555-5555-4555-8555-555555555555",
      "name" : "テキストを名前順"
    },
    {
      "filter" : {
        "descending" : true,
        "folderIds" : [

        ],
        "limit" : 80,
        "offset" : 0,
        "sortBy" : "created",
        "tagIds" : [

        ],
        "text" : "猫",
        "version" : 1,
        "view" : "recent"
      },
      "id" : "44444444-4444-4444-8444-444444444444",
      "name" : "猫の素材"
    }
  ],
  "tags" : [
    {
      "id" : "33333333-3333-4333-8333-333333333333",
      "name" : "Ｈａｌｆ幅",
      "parentId" : null
    }
  ],
  "version" : 1
}