{"assets":[{"createdAt":"2026-10-05T11:52:21.1644342+00:00","extension":"txt","favorite":true,"folderIds":["ae36151d-9e71-4e9d-9f5a-a2eb4cd74ffe"],"id":"31e2a6f6-9412-4655-a99a-63a8bd639da8","internetOrigin":false,"kind":"other","name":"Windowsで復元.txt","sha256":"b949c16ff62b4bf707a5100d71bf89f22094db92221052141f92c38d1b1ae4ac","sizeBytes":57,"tagIds":["80b4bf86-b7b2-4720-837c-c4e2b6857518"],"trashed":false},{"createdAt":"2026-10-05T11:48:28.069Z","extension":"txt","favorite":false,"folderIds":["c2e93dee-4278-46f8-b8ea-7454569500a6"],"id":"d38e5f10-ee5c-4a4d-8c20-cfaf15420b10","internetOrigin":false,"kind":"other","name":"Mac-日本語.txt","sha256":"35a59c0efc895c6684a577c8324e50be7bb1d90979230aef6cc2beadc9189931","sizeBytes":39,"tagIds":[],"trashed":false}],"createdAt":"2026-10-05T12:01:58.208Z","excludedPending":0,"folders":[{"id":"c2e93dee-4278-46f8-b8ea-7454569500a6","name":"Mac同期テスト","parentId":null},{"id":"44df2f38-8138-45c9-a0cc-d40b67581fa6","name":"Windows検証","parentId":null},{"id":"ae36151d-9e71-4e9d-9f5a-a2eb4cd74ffe","name":"子フォルダ","parentId":"44df2f38-8138-45c9-a0cc-d40b67581fa6"}],"searches":[],"tags":[{"id":"80b4bf86-b7b2-4720-837c-c4e2b6857518","name":"Windows検証タグ","parentId":null}],"version":1}